<?xml version="1.0" encoding="UTF-8"?>
<sed:weather id="clear" xmlns:sed="http://mycrobase.de/sed-weather-1.0" xmlns:xsi="http://www.w3.org/2001/XMLSchema-instance" xsi:schemaLocation="http://mycrobase.de/sed-weather-1.0 sed-weather-1.0.xsd">
    <air>
        <turbidity>2.0</turbidity>
    </air>
    <sky>
        <light>(0.2, 0.2, 0.2)</light>
    </sky>
    <sun>
        <lensflare>
            <enabled>true</enabled>
            <shininess>0.95</shininess>
        </lensflare>
    </sun>
    <ocean />
    <cloud>
        <cover>100</cover>
        <sharpness>0.96</sharpness>
        <way-factor>0.005</way-factor>
        <zoom>40</zoom> <!-- static value -->
    </cloud>
    <precipitation>
        <form>0</form>
        <intensity>0.0</intensity>
    </precipitation>
    <wind>
        <!-- from north west -->
        <direction>315</direction>
        <strength>0</strength>
    </wind>
</sed:weather>